{
  "schemaVersion": 1,
  "page": {
    "order": 1,
    "file": "001.webp",
    "width": 1200,
    "height": 800,
    "sourceSha256": "65731275faf68052d8f6e45721bfdbadd26f8a5d9bff96044e66ec4dfea0dcdb"
  },
  "policy": {
    "included": "English story text: dialogue, thoughts, narration, captions, and unbubbled spoken lines, including punctuation-only reactions and silent ellipses",
    "excluded": "sound effects, credits, scanlation promotion, translator notes, series branding, decorative labels, ambiguous OCR, and non-English text",
    "detectorUse": "proposal only; every region and omission was manually gated against the source image"
  },
  "regions": []
}
