{
  "schemaVersion": 1,
  "page": {
    "order": 7,
    "file": "007.webp",
    "width": 900,
    "height": 3565,
    "sourceSha256": "6e7bbd90c7319723a84ee201fe385cfd31b2955cb3d70c89c52e3e3bb23a920b"
  },
  "policy": {
    "included": "English story text: dialogue, thoughts, narration, captions, and unbubbled spoken lines, including punctuation-only reactions and silent ellipses",
    "excluded": "sound effects, credits, scanlation promotion, translator notes, series branding, decorative labels, ambiguous OCR, and non-English text",
    "detectorUse": "proposal only; every region and omission was manually gated against the source image"
  },
  "regions": [
    {
      "id": "30ysp-ch5-p007-r00",
      "kind": "dialogue",
      "containerStyle": "standard",
      "readingOrder": 0,
      "sourceEnglish": "Has it been seven years since we faced each other in person,",
      "normalizedEnglish": "Has it been seven years since we faced each other in person,",
      "textPolygon": [
        [
          0.25888889,
          0.54530154
        ],
        [
          0.74,
          0.54530154
        ],
        [
          0.74,
          0.63113604
        ],
        [
          0.25888889,
          0.63113604
        ]
      ],
      "eraseMask": {
        "encoding": "normalized-polygon-v1",
        "polygon": [
          [
            0.25555556,
            0.54446003
          ],
          [
            0.74333333,
            0.54446003
          ],
          [
            0.74333333,
            0.63197755
          ],
          [
            0.25555556,
            0.63197755
          ]
        ],
        "operation": "erase every English glyph, outline, punctuation mark, and antialiased edge inside the polygon; preserve every pixel outside the erase mask"
      },
      "geometryAudit": "manual",
      "reviewProvenance": {
        "type": "missedStoryTextRegion",
        "uncertainty": "low",
        "missedIndex": 1
      },
      "productionMatch": {
        "stableRegionId": "6e7bbd90-region-2555cd07b73a4ca2",
        "method": "stable-region-id-source-text-and-geometry",
        "textGeometryIou": 0.94756892
      },
      "simplifiedChinese": "我们面对面见面已经七年了，",
      "pinyin": "wǒ men miàn duì miàn jiàn miàn yǐ jīng qī Nián / nián le / liào / liǎo",
      "hskValidation": {
        "requestedLevel": 5,
        "strictlyValid": false,
        "aboveLevelTokens": [
          "面对面",
          "面见",
          "七年"
        ],
        "repairState": "pending"
      },
      "hskTokens": [
        {
          "text": "我们",
          "startChar": 0,
          "endChar": 2,
          "pinyin": "wǒ men",
          "classification": "hsk",
          "hskLevel": 1,
          "aboveRequestedLevel": false
        },
        {
          "text": "面对面",
          "startChar": 2,
          "endChar": 5,
          "pinyin": "miàn duì miàn",
          "classification": "non-hsk",
          "aboveRequestedLevel": true
        },
        {
          "text": "见面",
          "startChar": 5,
          "endChar": 7,
          "pinyin": "jiàn miàn",
          "classification": "hsk",
          "hskLevel": 3,
          "aboveRequestedLevel": false
        },
        {
          "text": "已经",
          "startChar": 7,
          "endChar": 9,
          "pinyin": "yǐ jīng",
          "classification": "hsk",
          "hskLevel": 2,
          "aboveRequestedLevel": false
        },
        {
          "text": "七",
          "startChar": 9,
          "endChar": 10,
          "pinyin": "qī",
          "classification": "hsk",
          "hskLevel": 1,
          "aboveRequestedLevel": false
        },
        {
          "text": "年",
          "startChar": 10,
          "endChar": 11,
          "pinyin": "Nián / nián",
          "classification": "hsk",
          "hskLevel": 1,
          "aboveRequestedLevel": false
        },
        {
          "text": "了",
          "startChar": 11,
          "endChar": 12,
          "pinyin": "le / liào / liǎo",
          "classification": "hsk",
          "hskLevel": 1,
          "aboveRequestedLevel": false
        }
      ]
    }
  ]
}
