{
  "schemaVersion": 1,
  "page": {
    "order": 23,
    "file": "023.webp",
    "width": 900,
    "height": 2672,
    "sourceSha256": "09771e944fd654ac3b1229dee02be25c8abb901ff230d5bb07d085127234eb8d"
  },
  "policy": {
    "included": "English story text: dialogue, thoughts, narration, captions, and unbubbled spoken lines, including punctuation-only reactions and silent ellipses",
    "excluded": "sound effects, credits, scanlation promotion, translator notes, series branding, decorative labels, ambiguous OCR, and non-English text",
    "detectorUse": "proposal only; every region and omission was manually gated against the source image"
  },
  "regions": [
    {
      "id": "30ysp-ch5-p023-r00",
      "kind": "dialogue",
      "containerStyle": "standard",
      "readingOrder": 0,
      "sourceEnglish": "SO THAT'S HOW THIS TURNED OUT.",
      "normalizedEnglish": "SO THAT'S HOW THIS TURNED OUT.",
      "textPolygon": [
        [
          0.41284722,
          0.2270654
        ],
        [
          0.9135417,
          0.2270654
        ],
        [
          0.9135417,
          0.2940798
        ],
        [
          0.41284722,
          0.2940798
        ]
      ],
      "eraseMask": {
        "encoding": "normalized-polygon-v1",
        "polygon": [
          [
            0.41,
            0.2275449
          ],
          [
            0.92,
            0.2275449
          ],
          [
            0.92,
            0.29640717
          ],
          [
            0.41,
            0.29640717
          ]
        ],
        "operation": "erase every English glyph, outline, punctuation mark, and antialiased edge inside the polygon; preserve every pixel outside the erase mask"
      },
      "geometryAudit": "detector-adjusted",
      "reviewProvenance": {
        "type": "acceptedProposal",
        "uncertainty": "low",
        "proposalIndex": 1,
        "reviewRegionId": "09771e94-region-df0bb42822772335"
      },
      "bubblePolygon": [
        [
          0.36423612,
          0.16613258
        ],
        [
          0.9635417,
          0.16613258
        ],
        [
          0.9635417,
          0.35688388
        ],
        [
          0.36423612,
          0.35688388
        ]
      ],
      "productionMatch": {
        "stableRegionId": "09771e94-region-df0bb42822772335",
        "method": "stable-region-id-and-text-geometry",
        "textGeometryIou": 1.0
      },
      "simplifiedChinese": "结果就是这样。",
      "pinyin": "jié guǒ / jiē guǒ jiù shì zhè yàng",
      "hskValidation": {
        "requestedLevel": 5,
        "strictlyValid": false,
        "aboveLevelTokens": [
          "就是",
          "这样",
          "样"
        ],
        "repairState": "pending"
      },
      "hskTokens": [
        {
          "text": "结果",
          "startChar": 0,
          "endChar": 2,
          "pinyin": "jié guǒ / jiē guǒ",
          "classification": "hsk",
          "hskLevel": 4,
          "aboveRequestedLevel": false
        },
        {
          "text": "就是",
          "startChar": 2,
          "endChar": 4,
          "pinyin": "jiù shì",
          "classification": "non-hsk",
          "aboveRequestedLevel": true
        },
        {
          "text": "这样",
          "startChar": 4,
          "endChar": 6,
          "pinyin": "zhè yàng",
          "classification": "non-hsk",
          "aboveRequestedLevel": true
        }
      ]
    }
  ]
}
