{
  "schemaVersion": 1,
  "page": {
    "order": 35,
    "file": "035.webp",
    "width": 900,
    "height": 3565,
    "sourceSha256": "0b7242b7f43e663d283647e1796b9a0160f8bb1388003e8b0a5d7545eb74dc8a"
  },
  "policy": {
    "included": "English story text: dialogue, thoughts, narration, captions, and unbubbled spoken lines, including punctuation-only reactions and silent ellipses",
    "excluded": "sound effects, credits, scanlation promotion, translator notes, series branding, decorative labels, ambiguous OCR, and non-English text",
    "detectorUse": "proposal only; every region and omission was manually gated against the source image"
  },
  "regions": [
    {
      "id": "30ysp-ch5-p035-r00",
      "kind": "narration",
      "containerStyle": "narration",
      "readingOrder": 0,
      "sourceEnglish": "And...",
      "normalizedEnglish": "And...",
      "textPolygon": [
        [
          0.34333333,
          0.24123422
        ],
        [
          0.66444444,
          0.24123422
        ],
        [
          0.66444444,
          0.29200561
        ],
        [
          0.34333333,
          0.29200561
        ]
      ],
      "eraseMask": {
        "encoding": "normalized-polygon-v1",
        "polygon": [
          [
            0.34,
            0.24039271
          ],
          [
            0.66777777,
            0.24039271
          ],
          [
            0.66777777,
            0.29284712
          ],
          [
            0.34,
            0.29284712
          ]
        ],
        "operation": "erase every English glyph, outline, punctuation mark, and antialiased edge inside the polygon; preserve every pixel outside the erase mask"
      },
      "geometryAudit": "manual",
      "reviewProvenance": {
        "type": "missedStoryTextRegion",
        "uncertainty": "low",
        "missedIndex": 1
      },
      "simplifiedChinese": "还有……",
      "pinyin": "Hái yǒu...",
      "hskTokens": [
        {
          "text": "还有",
          "startChar": 0,
          "endChar": 2,
          "pinyin": "hái yǒu",
          "classification": "non-hsk",
          "aboveRequestedLevel": true
        }
      ]
    }
  ]
}
