{
  "schemaVersion": 1,
  "page": {
    "order": 17,
    "file": "017.webp",
    "width": 900,
    "height": 2502,
    "sourceSha256": "700d24e9b1d2b0cc46e3734b04fcab844b22929991bb85a4dbd1e47ef65b0e02"
  },
  "policy": {
    "included": "English story text: dialogue, thoughts, narration, captions, and unbubbled spoken lines, including punctuation-only reactions and silent ellipses",
    "excluded": "sound effects, credits, scanlation promotion, translator notes, series branding, decorative labels, ambiguous OCR, and non-English text",
    "detectorUse": "proposal only; every region and omission was manually gated against the source image"
  },
  "regions": [
    {
      "id": "30ysp-ch5-p017-r00",
      "kind": "thought",
      "containerStyle": "thought",
      "readingOrder": 0,
      "sourceEnglish": "If so... don't tell me she has...",
      "normalizedEnglish": "If so... don't tell me she has...",
      "textPolygon": [
        [
          0.17534722,
          0.22491382
        ],
        [
          0.8163194,
          0.22491382
        ],
        [
          0.8163194,
          0.33264014
        ],
        [
          0.17534722,
          0.33264014
        ]
      ],
      "eraseMask": {
        "encoding": "normalized-polygon-v1",
        "polygon": [
          [
            0.20333333,
            0.23341326
          ],
          [
            0.79555553,
            0.23341326
          ],
          [
            0.79555553,
            0.32254195
          ],
          [
            0.20333333,
            0.32254195
          ]
        ],
        "operation": "erase every English glyph, outline, punctuation mark, and antialiased edge inside the polygon; preserve every pixel outside the erase mask"
      },
      "geometryAudit": "detector-adjusted",
      "reviewProvenance": {
        "type": "acceptedProposal",
        "uncertainty": "low",
        "proposalIndex": 1,
        "reviewRegionId": "700d24e9-region-c63a559840288f31"
      },
      "bubblePolygon": [
        [
          0.0,
          0.0
        ],
        [
          1.0,
          0.0
        ],
        [
          1.0,
          0.5105915
        ],
        [
          0.0,
          0.5105915
        ]
      ],
      "productionMatch": {
        "stableRegionId": "700d24e9-region-c63a559840288f31",
        "method": "stable-region-id-and-text-geometry",
        "textGeometryIou": 1.0
      },
      "simplifiedChinese": "如果是这样。。。。。。就别告诉她。。。。。。",
      "pinyin": "rú guǒ shì zhè yàng jiù Bié / biè / bié gào su / gào sù tā",
      "hskValidation": {
        "requestedLevel": 5,
        "strictlyValid": false,
        "aboveLevelTokens": [
          "这样",
          "样",
          "就别"
        ],
        "repairState": "pending"
      },
      "hskTokens": [
        {
          "text": "如果",
          "startChar": 0,
          "endChar": 2,
          "pinyin": "rú guǒ",
          "classification": "hsk",
          "hskLevel": 3,
          "aboveRequestedLevel": false
        },
        {
          "text": "是",
          "startChar": 2,
          "endChar": 3,
          "pinyin": "shì",
          "classification": "hsk",
          "hskLevel": 1,
          "aboveRequestedLevel": false
        },
        {
          "text": "这样",
          "startChar": 3,
          "endChar": 5,
          "pinyin": "zhè yàng",
          "classification": "non-hsk",
          "aboveRequestedLevel": true
        },
        {
          "text": "就",
          "startChar": 11,
          "endChar": 12,
          "pinyin": "jiù",
          "classification": "hsk",
          "hskLevel": 2,
          "aboveRequestedLevel": false
        },
        {
          "text": "别",
          "startChar": 12,
          "endChar": 13,
          "pinyin": "Bié / biè / bié",
          "classification": "hsk",
          "hskLevel": 2,
          "aboveRequestedLevel": false
        },
        {
          "text": "告诉",
          "startChar": 13,
          "endChar": 15,
          "pinyin": "gào su / gào sù",
          "classification": "hsk",
          "hskLevel": 2,
          "aboveRequestedLevel": false
        },
        {
          "text": "她",
          "startChar": 15,
          "endChar": 16,
          "pinyin": "tā",
          "classification": "hsk",
          "hskLevel": 1,
          "aboveRequestedLevel": false
        }
      ]
    }
  ]
}
