{
  "schemaVersion": 1,
  "page": {
    "order": 9,
    "file": "009.webp",
    "width": 900,
    "height": 2470,
    "sourceSha256": "add90fce17375f4c1a2574099d0f2c91cf1400d0b7aa6bd0062ae315352886ce"
  },
  "policy": {
    "included": "English story text: dialogue, thoughts, narration, captions, and unbubbled spoken lines, including punctuation-only reactions and silent ellipses",
    "excluded": "sound effects, credits, scanlation promotion, translator notes, series branding, decorative labels, ambiguous OCR, and non-English text",
    "detectorUse": "proposal only; every region and omission was manually gated against the source image"
  },
  "regions": [
    {
      "id": "30ysp-ch5-p009-r00",
      "kind": "narration",
      "containerStyle": "narration",
      "readingOrder": 0,
      "sourceEnglish": "MY GRANDMASTER,",
      "normalizedEnglish": "MY GRANDMASTER,",
      "textPolygon": [
        [
          0.13680555,
          0.07916877
        ],
        [
          0.86041665,
          0.07916877
        ],
        [
          0.86041665,
          0.13211665
        ],
        [
          0.13680555,
          0.13211665
        ]
      ],
      "eraseMask": {
        "encoding": "normalized-polygon-v1",
        "polygon": [
          [
            0.15111111,
            0.08218624
          ],
          [
            0.85111111,
            0.08218624
          ],
          [
            0.85111111,
            0.1291498
          ],
          [
            0.15111111,
            0.1291498
          ]
        ],
        "operation": "erase every English glyph, outline, punctuation mark, and antialiased edge inside the polygon; preserve every pixel outside the erase mask"
      },
      "geometryAudit": "detector-adjusted",
      "reviewProvenance": {
        "type": "acceptedProposal",
        "uncertainty": "low",
        "proposalIndex": 1,
        "reviewRegionId": "add90fce-region-47aaa77fa398578e"
      },
      "bubblePolygon": [
        [
          0.13680555,
          0.07916877
        ],
        [
          0.86041665,
          0.07916877
        ],
        [
          0.86041665,
          0.13211665
        ],
        [
          0.13680555,
          0.13211665
        ]
      ],
      "productionMatch": {
        "stableRegionId": "add90fce-region-47aaa77fa398578e",
        "method": "stable-region-id-and-text-geometry",
        "textGeometryIou": 1.0
      },
      "simplifiedChinese": "我的师父，",
      "pinyin": "wǒ de / dì / dí / dī shī fu",
      "hskValidation": {
        "requestedLevel": 5,
        "strictlyValid": false,
        "aboveLevelTokens": [
          "师父",
          "师",
          "父"
        ],
        "repairState": "pending"
      },
      "hskTokens": [
        {
          "text": "我",
          "startChar": 0,
          "endChar": 1,
          "pinyin": "wǒ",
          "classification": "hsk",
          "hskLevel": 1,
          "aboveRequestedLevel": false
        },
        {
          "text": "的",
          "startChar": 1,
          "endChar": 2,
          "pinyin": "de / dì / dí / dī",
          "classification": "hsk",
          "hskLevel": 1,
          "aboveRequestedLevel": false
        },
        {
          "text": "师父",
          "startChar": 2,
          "endChar": 4,
          "pinyin": "shī fu",
          "classification": "non-hsk",
          "aboveRequestedLevel": true
        }
      ]
    },
    {
      "id": "30ysp-ch5-p009-r01",
      "kind": "narration",
      "containerStyle": "narration",
      "readingOrder": 1,
      "sourceEnglish": "\"The Traitor,\" Enrique.",
      "normalizedEnglish": "\"The Traitor,\" Enrique.",
      "textPolygon": [
        [
          0.09166667,
          0.79092866
        ],
        [
          0.89444447,
          0.79092866
        ],
        [
          0.89444447,
          0.95755315
        ],
        [
          0.09166667,
          0.95755315
        ]
      ],
      "eraseMask": {
        "encoding": "normalized-polygon-v1",
        "polygon": [
          [
            0.10666667,
            0.7991903
          ],
          [
            0.89333337,
            0.7991903
          ],
          [
            0.89333337,
            0.9574899
          ],
          [
            0.10666667,
            0.9574899
          ]
        ],
        "operation": "erase every English glyph, outline, punctuation mark, and antialiased edge inside the polygon; preserve every pixel outside the erase mask"
      },
      "geometryAudit": "detector-adjusted",
      "reviewProvenance": {
        "type": "acceptedProposal",
        "uncertainty": "low",
        "proposalIndex": 2,
        "reviewRegionId": "add90fce-region-b2c37a3f85cdc1df"
      },
      "bubblePolygon": [
        [
          0.0,
          0.48178136
        ],
        [
          1.0,
          0.48178136
        ],
        [
          1.0,
          0.99873483
        ],
        [
          0.0,
          0.99873483
        ]
      ],
      "productionMatch": {
        "stableRegionId": "add90fce-region-b2c37a3f85cdc1df",
        "method": "stable-region-id-and-text-geometry",
        "textGeometryIou": 1.0
      },
      "simplifiedChinese": "恩里克。",
      "pinyin": "ēn Lǐ / lǐ Kè / kè / kēi",
      "hskValidation": {
        "requestedLevel": 5,
        "strictlyValid": false,
        "aboveLevelTokens": [
          "恩里克",
          "恩"
        ],
        "repairState": "pending"
      },
      "hskTokens": [
        {
          "text": "恩",
          "startChar": 0,
          "endChar": 1,
          "pinyin": "ēn",
          "classification": "non-hsk",
          "aboveRequestedLevel": true
        },
        {
          "text": "里",
          "startChar": 1,
          "endChar": 2,
          "pinyin": "Lǐ / lǐ",
          "classification": "hsk",
          "hskLevel": 1,
          "aboveRequestedLevel": false
        },
        {
          "text": "克",
          "startChar": 2,
          "endChar": 3,
          "pinyin": "Kè / kè / kēi",
          "classification": "hsk",
          "hskLevel": 5,
          "aboveRequestedLevel": false
        }
      ]
    }
  ]
}
