{
  "schemaVersion": 1,
  "page": {
    "order": 3,
    "file": "003.webp",
    "width": 900,
    "height": 2404,
    "sourceSha256": "434ee801265888a1cde056de6f400492bd276042809dd867b3f450a4657b1ceb"
  },
  "policy": {
    "included": "English story text: dialogue, thoughts, narration, captions, and unbubbled spoken lines, including punctuation-only reactions and silent ellipses",
    "excluded": "sound effects, credits, scanlation promotion, translator notes, series branding, decorative labels, ambiguous OCR, and non-English text",
    "detectorUse": "proposal only; every region and omission was manually gated against the source image"
  },
  "regions": [
    {
      "id": "30ysp-ch5-p003-r00",
      "kind": "narration",
      "containerStyle": "narration",
      "readingOrder": 0,
      "sourceEnglish": "THE MIDDLE OF THE CAPITAL",
      "normalizedEnglish": "THE MIDDLE OF THE CAPITAL",
      "textPolygon": [
        [
          0.12708333,
          0.0
        ],
        [
          0.8756944,
          0.0
        ],
        [
          0.8756944,
          0.02932937
        ],
        [
          0.12708333,
          0.02932937
        ]
      ],
      "eraseMask": {
        "encoding": "normalized-polygon-v1",
        "polygon": [
          [
            0.11444444,
            0.0
          ],
          [
            0.8888889,
            0.0
          ],
          [
            0.8888889,
            0.03410982
          ],
          [
            0.11444444,
            0.03410982
          ]
        ],
        "operation": "erase every English glyph, outline, punctuation mark, and antialiased edge inside the polygon; preserve every pixel outside the erase mask"
      },
      "geometryAudit": "detector-adjusted",
      "reviewProvenance": {
        "type": "acceptedProposal",
        "uncertainty": "low",
        "proposalIndex": 1,
        "reviewRegionId": "434ee801-region-1c01568720e06835"
      },
      "bubblePolygon": [
        [
          0.11477431,
          0.00024414
        ],
        [
          0.88689233,
          0.00024414
        ],
        [
          0.88689233,
          0.02966309
        ],
        [
          0.11477431,
          0.02966309
        ]
      ],
      "productionMatch": {
        "stableRegionId": "434ee801-region-1c01568720e06835",
        "method": "stable-region-id-and-text-geometry",
        "textGeometryIou": 1.0
      },
      "simplifiedChinese": "首都的中间",
      "pinyin": "shǒu dū de / dì / dí / dī zhōng jiān",
      "hskValidation": {
        "requestedLevel": 5,
        "strictlyValid": true,
        "aboveLevelTokens": [],
        "repairState": "not-needed"
      },
      "hskTokens": [
        {
          "text": "首都",
          "startChar": 0,
          "endChar": 2,
          "pinyin": "shǒu dū",
          "classification": "hsk",
          "hskLevel": 4,
          "aboveRequestedLevel": false
        },
        {
          "text": "的",
          "startChar": 2,
          "endChar": 3,
          "pinyin": "de / dì / dí / dī",
          "classification": "hsk",
          "hskLevel": 1,
          "aboveRequestedLevel": false
        },
        {
          "text": "中间",
          "startChar": 3,
          "endChar": 5,
          "pinyin": "zhōng jiān",
          "classification": "hsk",
          "hskLevel": 3,
          "aboveRequestedLevel": false
        }
      ]
    },
    {
      "id": "30ysp-ch5-p003-r01",
      "kind": "dialogue",
      "containerStyle": "unbubbled",
      "readingOrder": 1,
      "sourceEnglish": "Good heavens...",
      "normalizedEnglish": "Good heavens...",
      "textPolygon": [
        [
          0.1,
          0.24209651
        ],
        [
          0.44333333,
          0.24209651
        ],
        [
          0.44333333,
          0.27953411
        ],
        [
          0.1,
          0.27953411
        ]
      ],
      "eraseMask": {
        "encoding": "normalized-polygon-v1",
        "polygon": [
          [
            0.09666667,
            0.24084859
          ],
          [
            0.44666666,
            0.24084859
          ],
          [
            0.44666666,
            0.28078203
          ],
          [
            0.09666667,
            0.28078203
          ]
        ],
        "operation": "erase every English glyph, outline, punctuation mark, and antialiased edge inside the polygon; preserve every pixel outside the erase mask"
      },
      "geometryAudit": "manual",
      "reviewProvenance": {
        "type": "missedStoryTextRegion",
        "uncertainty": "medium",
        "missedIndex": 1
      },
      "simplifiedChinese": "天哪……",
      "pinyin": "Tiān na...",
      "hskTokens": [
        {
          "text": "天哪",
          "startChar": 0,
          "endChar": 2,
          "pinyin": "tiān na",
          "classification": "non-hsk",
          "aboveRequestedLevel": true
        }
      ]
    },
    {
      "id": "30ysp-ch5-p003-r02",
      "kind": "narration",
      "containerStyle": "narration",
      "readingOrder": 2,
      "sourceEnglish": "AND THE REASON NO ONE CARED THAT IT WAS STOLEN",
      "normalizedEnglish": "AND THE REASON NO ONE CARED THAT IT WAS STOLEN",
      "textPolygon": [
        [
          0.19809029,
          0.63992953
        ],
        [
          0.79357636,
          0.63992953
        ],
        [
          0.79357636,
          0.7529573
        ],
        [
          0.19809029,
          0.7529573
        ]
      ],
      "eraseMask": {
        "encoding": "normalized-polygon-v1",
        "polygon": [
          [
            0.19666667,
            0.64267886
          ],
          [
            0.80333337,
            0.64267886
          ],
          [
            0.80333337,
            0.74999999
          ],
          [
            0.19666667,
            0.74999999
          ]
        ],
        "operation": "erase every English glyph, outline, punctuation mark, and antialiased edge inside the polygon; preserve every pixel outside the erase mask"
      },
      "geometryAudit": "detector-adjusted",
      "reviewProvenance": {
        "type": "acceptedProposal",
        "uncertainty": "low",
        "proposalIndex": 2,
        "reviewRegionId": "434ee801-region-6d3fc79a28afd131"
      },
      "bubblePolygon": [
        [
          0.19809029,
          0.63992953
        ],
        [
          0.79357636,
          0.63992953
        ],
        [
          0.79357636,
          0.7529573
        ],
        [
          0.19809029,
          0.7529573
        ]
      ],
      "productionMatch": {
        "stableRegionId": "434ee801-region-6d3fc79a28afd131",
        "method": "stable-region-id-and-text-geometry",
        "textGeometryIou": 1.0
      },
      "simplifiedChinese": "没人关心它被偷了的原因",
      "pinyin": "méi / mò rén guān xīn tā bèi tōu le / liào / liǎo de / dì / dí / dī yuán yīn",
      "hskValidation": {
        "requestedLevel": 5,
        "strictlyValid": false,
        "aboveLevelTokens": [
          "没人",
          "没"
        ],
        "repairState": "pending"
      },
      "hskTokens": [
        {
          "text": "没",
          "startChar": 0,
          "endChar": 1,
          "pinyin": "méi / mò",
          "classification": "non-hsk",
          "aboveRequestedLevel": true
        },
        {
          "text": "人",
          "startChar": 1,
          "endChar": 2,
          "pinyin": "rén",
          "classification": "hsk",
          "hskLevel": 1,
          "aboveRequestedLevel": false
        },
        {
          "text": "关心",
          "startChar": 2,
          "endChar": 4,
          "pinyin": "guān xīn",
          "classification": "hsk",
          "hskLevel": 3,
          "aboveRequestedLevel": false
        },
        {
          "text": "它",
          "startChar": 4,
          "endChar": 5,
          "pinyin": "tā",
          "classification": "hsk",
          "hskLevel": 2,
          "aboveRequestedLevel": false
        },
        {
          "text": "被",
          "startChar": 5,
          "endChar": 6,
          "pinyin": "bèi",
          "classification": "hsk",
          "hskLevel": 3,
          "aboveRequestedLevel": false
        },
        {
          "text": "偷",
          "startChar": 6,
          "endChar": 7,
          "pinyin": "tōu",
          "classification": "hsk",
          "hskLevel": 5,
          "aboveRequestedLevel": false
        },
        {
          "text": "了",
          "startChar": 7,
          "endChar": 8,
          "pinyin": "le / liào / liǎo",
          "classification": "hsk",
          "hskLevel": 1,
          "aboveRequestedLevel": false
        },
        {
          "text": "的",
          "startChar": 8,
          "endChar": 9,
          "pinyin": "de / dì / dí / dī",
          "classification": "hsk",
          "hskLevel": 1,
          "aboveRequestedLevel": false
        },
        {
          "text": "原因",
          "startChar": 9,
          "endChar": 11,
          "pinyin": "yuán yīn",
          "classification": "hsk",
          "hskLevel": 4,
          "aboveRequestedLevel": false
        }
      ]
    }
  ]
}
