{
  "schemaVersion": 1,
  "page": {
    "order": 5,
    "file": "005.webp",
    "width": 900,
    "height": 2913,
    "sourceSha256": "f264a75aae085341322ead9395a2d211cf2cc4fd5e307fca339067f1abe013b2"
  },
  "policy": {
    "included": "English story text: dialogue, thoughts, narration, captions, and unbubbled spoken lines, including punctuation-only reactions and silent ellipses",
    "excluded": "sound effects, credits, scanlation promotion, translator notes, series branding, decorative labels, ambiguous OCR, and non-English text",
    "detectorUse": "proposal only; every region and omission was manually gated against the source image"
  },
  "regions": [
    {
      "id": "30ysp-ch5-p005-r00",
      "kind": "dialogue",
      "containerStyle": "standard",
      "readingOrder": 0,
      "sourceEnglish": "DO NOT MOURN THOSE WHO LEFT BEFORE US.",
      "normalizedEnglish": "DO NOT MOURN THOSE WHO LEFT BEFORE US.",
      "textPolygon": [
        [
          0.2048611,
          0.7873595
        ],
        [
          0.79791665,
          0.7873595
        ],
        [
          0.79791665,
          0.86240023
        ],
        [
          0.2048611,
          0.86240023
        ]
      ],
      "eraseMask": {
        "encoding": "normalized-polygon-v1",
        "polygon": [
          [
            0.19333333,
            0.7864744
          ],
          [
            0.81444443,
            0.7864744
          ],
          [
            0.81444443,
            0.86508752
          ],
          [
            0.19333333,
            0.86508752
          ]
        ],
        "operation": "erase every English glyph, outline, punctuation mark, and antialiased edge inside the polygon; preserve every pixel outside the erase mask"
      },
      "geometryAudit": "detector-adjusted",
      "reviewProvenance": {
        "type": "acceptedProposal",
        "uncertainty": "low",
        "proposalIndex": 1,
        "reviewRegionId": "f264a75a-region-ccafa22dae76c48f"
      },
      "bubblePolygon": [
        [
          0.1375,
          0.7208205
        ],
        [
          0.86388886,
          0.7208205
        ],
        [
          0.86388886,
          0.9315139
        ],
        [
          0.1375,
          0.9315139
        ]
      ],
      "productionMatch": {
        "stableRegionId": "f264a75a-region-ccafa22dae76c48f",
        "method": "stable-region-id-and-text-geometry",
        "textGeometryIou": 1.0
      },
      "simplifiedChinese": "不要哀悼那些在我们之前离开的人。",
      "pinyin": "bù yào āi dào nà xiē zài wǒ men zhī qián lí kāi de / dì / dí / dī rén",
      "hskValidation": {
        "requestedLevel": 5,
        "strictlyValid": false,
        "aboveLevelTokens": [
          "不要",
          "哀悼",
          "哀",
          "悼",
          "那些",
          "之前",
          "前"
        ],
        "repairState": "pending"
      },
      "hskTokens": [
        {
          "text": "不要",
          "startChar": 0,
          "endChar": 2,
          "pinyin": "bù yào",
          "classification": "non-hsk",
          "aboveRequestedLevel": true
        },
        {
          "text": "哀悼",
          "startChar": 2,
          "endChar": 4,
          "pinyin": "āi dào",
          "classification": "non-hsk",
          "aboveRequestedLevel": true
        },
        {
          "text": "那些",
          "startChar": 4,
          "endChar": 6,
          "pinyin": "nà xiē",
          "classification": "non-hsk",
          "aboveRequestedLevel": true
        },
        {
          "text": "在",
          "startChar": 6,
          "endChar": 7,
          "pinyin": "zài",
          "classification": "hsk",
          "hskLevel": 1,
          "aboveRequestedLevel": false
        },
        {
          "text": "我们",
          "startChar": 7,
          "endChar": 9,
          "pinyin": "wǒ men",
          "classification": "hsk",
          "hskLevel": 1,
          "aboveRequestedLevel": false
        },
        {
          "text": "之前",
          "startChar": 9,
          "endChar": 11,
          "pinyin": "zhī qián",
          "classification": "non-hsk",
          "aboveRequestedLevel": true
        },
        {
          "text": "离开",
          "startChar": 11,
          "endChar": 13,
          "pinyin": "lí kāi",
          "classification": "hsk",
          "hskLevel": 3,
          "aboveRequestedLevel": false
        },
        {
          "text": "的",
          "startChar": 13,
          "endChar": 14,
          "pinyin": "de / dì / dí / dī",
          "classification": "hsk",
          "hskLevel": 1,
          "aboveRequestedLevel": false
        },
        {
          "text": "人",
          "startChar": 14,
          "endChar": 15,
          "pinyin": "rén",
          "classification": "hsk",
          "hskLevel": 1,
          "aboveRequestedLevel": false
        }
      ]
    }
  ]
}
